PMID,Title,Authors,Citation,First Author,Journal/Book,Publication Year,Create Date,PMCID,NIHMS ID,DOI
"21550748","An empirical investigation of motion effects in eMRI of interictal epileptiform spikes","Sundaram P, Mulkern RV, Wells WM, Triantafyllou C, Loddenkemper T, Bubrick EJ, Orbach DB.","Magn Reson Imaging. 2011 Dec;29(10):1401-9. doi: 10.1016/j.mri.2011.03.007. Epub 2011 May 8.","Sundaram P","Magn Reson Imaging","2011","2011/05/10","PMC3265326","NIHMS285888","10.1016/j.mri.2011.03.007"
"21281369","Functional connectivity in slow-wave sleep: identification of synchronous cortical activity during wakefulness and sleep using time series analysis of electroencephalographic data","Langheim FJ, Murphy M, Riedner BA, Tononi G.","J Sleep Res. 2011 Dec;20(4):496-505. doi: 10.1111/j.1365-2869.2011.00911.x. Epub 2011 Feb 1.","Langheim FJ","J Sleep Res","2011","2011/02/02","PMC3134541","NIHMS267665","10.1111/j.1365-2869.2011.00911.x"
"22049407","Event-related potentials elicited by errors during the stop-signal task. I. Macaque monkeys","Godlove DC, Emeric EE, Segovis CM, Young MS, Schall JD, Woodman GF.","J Neurosci. 2011 Nov 2;31(44):15640-9. doi: 10.1523/JNEUROSCI.3349-11.2011.","Godlove DC","J Neurosci","2011","2011/11/04","PMC3241968","NIHMS337344","10.1523/JNEUROSCI.3349-11.2011"
"21824842","Removal of spurious coherence in MEG source-space coherence analysis","Sekihara K, Owen JP, Trisno S, Nagarajan SS.","IEEE Trans Biomed Eng. 2011 Nov;58(11):3121-9. doi: 10.1109/TBME.2011.2162514. Epub 2011 Aug 4.","Sekihara K","IEEE Trans Biomed Eng","2011","2011/08/10","PMC4096348","NIHMS592106","10.1109/TBME.2011.2162514"
"21816225","Occipital gamma-oscillations modulated during eye movement tasks: simultaneous eye tracking and electrocorticography recording in epileptic patients","Nagasawa T, Matsuzaki N, Juhász C, Hanazawa A, Shah A, Mittal S, Sood S, Asano E.","Neuroimage. 2011 Oct 15;58(4):1101-9. doi: 10.1016/j.neuroimage.2011.07.043. Epub 2011 Jul 22.","Nagasawa T","Neuroimage","2011","2011/08/06","PMC3171622","NIHMS314625","10.1016/j.neuroimage.2011.07.043"
"22319461","Kurtosis-based blind source extraction of complex non-circular signals with application in EEG artifact removal in real-time","Javidi S, Mandic DP, Took CC, Cichocki A.","Front Neurosci. 2011 Oct 10;5:105. doi: 10.3389/fnins.2011.00105. eCollection 2011.","Javidi S","Front Neurosci","2011","2012/02/10","PMC3240778","","10.3389/fnins.2011.00105"
"21692794","Seizure prediction with spectral power of EEG using cost-sensitive support vector machines","Park Y, Luo L, Parhi KK, Netoff T.","Epilepsia. 2011 Oct;52(10):1761-70. doi: 10.1111/j.1528-1167.2011.03138.x. Epub 2011 Jun 21.","Park Y","Epilepsia","2011","2011/06/23","","","10.1111/j.1528-1167.2011.03138.x"
"21939560","Real-time feature extraction of P300 component using adaptive nonlinear principal component analysis","Turnip A, Hong KS, Jeong MY.","Biomed Eng Online. 2011 Sep 23;10:83. doi: 10.1186/1475-925X-10-83.","Turnip A","Biomed Eng Online","2011","2011/09/24","PMC3749271","","10.1186/1475-925X-10-83"
"21909333","The use of electroencephalography in language production research: a review","Ganushchak LY, Christoffels IK, Schiller NO.","Front Psychol. 2011 Sep 1;2:208. doi: 10.3389/fpsyg.2011.00208. eCollection 2011.","Ganushchak LY","Front Psychol","2011","2011/09/13","PMC3164111","","10.3389/fpsyg.2011.00208"
"21810266","Automatic classification of artifactual ICA-components for artifact removal in EEG signals","Winkler I, Haufe S, Tangermann M.","Behav Brain Funct. 2011 Aug 2;7:30. doi: 10.1186/1744-9081-7-30.","Winkler I","Behav Brain Funct","2011","2011/08/04","PMC3175453","","10.1186/1744-9081-7-30"
"21722376","EEG spectral coherence data distinguish chronic fatigue syndrome patients from healthy controls and depressed patients--a case control study","Duffy FH, McAnulty GB, McCreary MC, Cuchural GJ, Komaroff AL.","BMC Neurol. 2011 Jul 1;11:82. doi: 10.1186/1471-2377-11-82.","Duffy FH","BMC Neurol","2011","2011/07/05","PMC3146818","","10.1186/1471-2377-11-82"
"21730950","Investigating social cognition in infants and adults using dense array electroencephalography ((d)EEG)","Akano AJ, Haley DW, Dudek J.","J Vis Exp. 2011 Jun 27;(52):2759. doi: 10.3791/2759.","Akano AJ","J Vis Exp","2011","2011/07/07","PMC3197049","","10.3791/2759"
"21399512","Comparison of blind source separation methods in fast somatosensory-evoked potential detection","Liu H, Chang CQ, Luk KD, Hu Y.","J Clin Neurophysiol. 2011 Apr;28(2):170-7. doi: 10.1097/WNP.0b013e31821213bd.","Liu H","J Clin Neurophysiol","2011","2011/03/15","","","10.1097/WNP.0b013e31821213bd"
"21716921","Increased intra-participant variability in children with autistic spectrum disorders: evidence from single-trial analysis of evoked EEG","Milne E.","Front Psychol. 2011 Mar 30;2:51. doi: 10.3389/fpsyg.2011.00051. eCollection 2011.","Milne E","Front Psychol","2011","2011/07/01","PMC3110871","","10.3389/fpsyg.2011.00051"
"21393090","Propofol withdrawal seizures: non-epileptic nature of seizures in a patient with recently controlled status epilepticus","Zubair S, Patton T, Smithson K, Sonmezturk HH, Arain A, Abou-Khalil B.","Epileptic Disord. 2011 Mar;13(1):107-10. doi: 10.1684/epd.2011.0404.","Zubair S","Epileptic Disord","2011","2011/03/12","","","10.1684/epd.2011.0404"
"20713314","EEG-based neonatal seizure detection with Support Vector Machines","Temko A, Thomas E, Marnane W, Lightbody G, Boylan G.","Clin Neurophysiol. 2011 Mar;122(3):464-473. doi: 10.1016/j.clinph.2010.06.034. Epub 2010 Aug 14.","Temko A","Clin Neurophysiol","2011","2010/08/18","PMC3036797","","10.1016/j.clinph.2010.06.034"
"20932913","Reducing the gradient artefact in simultaneous EEG-fMRI by adjusting the subject's axial position","Mullinger KJ, Yan WX, Bowtell R.","Neuroimage. 2011 Feb 1;54(3):1942-50. doi: 10.1016/j.neuroimage.2010.09.079. Epub 2010 Oct 13.","Mullinger KJ","Neuroimage","2011","2010/10/12","PMC3095086","UKMS34064","10.1016/j.neuroimage.2010.09.079"
"21074560","Trial-to-trial noise cancellation of cortical field potentials in awake macaques by autoregression model with exogenous input (ARX)","Wang Z, Roe AW.","J Neurosci Methods. 2011 Jan 15;194(2):266-73. doi: 10.1016/j.jneumeth.2010.10.029. Epub 2010 Nov 11.","Wang Z","J Neurosci Methods","2011","2010/11/16","PMC3016288","NIHMS257095","10.1016/j.jneumeth.2010.10.029"
"22256331","A novel cable-driven robotic training improves locomotor function in individuals post-stroke","Wu M, Landry JM, Yen SC, Schmit BD, Hornby TG, Rafferty M.","Annu Int Conf IEEE Eng Med Biol Soc. 2011;2011:8539-42. doi: 10.1109/IEMBS.2011.6092107.","Wu M","Annu Int Conf IEEE Eng Med Biol Soc","2011","2012/01/19","PMC4006736","NIHMS450011","10.1109/IEMBS.2011.6092107"
"21461381","fMRI artefact rejection and sleep scoring toolbox","Leclercq Y, Schrouff J, Noirhomme Q, Maquet P, Phillips C.","Comput Intell Neurosci. 2011;2011:598206. doi: 10.1155/2011/598206. Epub 2011 Mar 13.","Leclercq Y","Comput Intell Neurosci","2011","2011/04/05","PMC3063413","","10.1155/2011/598206"
"21051491","Explaining Entropy responses after a noxious stimulus, with or without neuromuscular blocking agents, by means of the raw electroencephalographic and electromyographic characteristics","Aho AJ, Lyytikäinen LP, Yli-Hankala A, Kamata K, Jäntti V.","Br J Anaesth. 2011 Jan;106(1):69-76. doi: 10.1093/bja/aeq300. Epub 2010 Nov 4.","Aho AJ","Br J Anaesth","2011","2010/11/06","","","10.1093/bja/aeq300"
"20981275","Electromyogenic Artifacts and Electroencephalographic Inferences Revisited","McMenamin BW, Shackman AJ, Greischar LL, Davidson RJ.","Neuroimage. 2011 Jan 1;54(1):4-9. doi: 10.1016/j.neuroimage.2010.07.057. Epub 2010 Aug 2.","McMenamin BW","Neuroimage","2011","2010/10/29","PMC2962711","NIHMS224675","10.1016/j.neuroimage.2010.07.057"
"21092128","Peak and averaged bicoherence for different EEG patterns during general anaesthesia","Pritchett S, Zilberg E, Xu ZM, Myles P, Brown I, Burton D.","Biomed Eng Online. 2010 Nov 20;9:76. doi: 10.1186/1475-925X-9-76.","Pritchett S","Biomed Eng Online","2010","2010/11/25","PMC2998515","","10.1186/1475-925X-9-76"
"21198150","""Seeing"" electroencephalogram through the skull: imaging prefrontal cortex with fast optical signal","Medvedev AV, Kainerstorfer JM, Borisov SV, Gandjbakhche AH, Vanmeter J.","J Biomed Opt. 2010 Nov-Dec;15(6):061702. doi: 10.1117/1.3505007.","Medvedev AV","J Biomed Opt","2010","2011/01/05","PMC3003719","","10.1117/1.3505007"
"21188288","SIGNAL REGULARITY-BASED AUTOMATED SEIZURE DETECTION SYSTEM FOR SCALP EEG MONITORING","Shiau DS, Halford JJ, Kelly KM, Kern RT, Inman M, Chien JH, Pardalos PM, Yang MC, Sackellares JC.","Cybern Syst Anal. 2010 Nov 1;46(6):922-935. doi: 10.1007/s10559-010-9273-3.","Shiau DS","Cybern Syst Anal","2010","2010/12/29","PMC3008625","NIHMS258241","10.1007/s10559-010-9273-3"
"20888265","Feasibility of online seizure detection with continuous EEG monitoring in the intensive care unit","Ponten SC, Ronner HE, Strijers RL, Visser MC, Peerdeman SM, Vandertop WP, Beishuizen A, Girbes AR, Stam CJ.","Seizure. 2010 Nov;19(9):580-6. doi: 10.1016/j.seizure.2010.09.007.","Ponten SC","Seizure","2010","2010/10/05","","","10.1016/j.seizure.2010.09.007"
"20810694","Unsupervised classification of high-frequency oscillations in human neocortical epilepsy and control patients","Blanco JA, Stead M, Krieger A, Viventi J, Marsh WR, Lee KH, Worrell GA, Litt B.","J Neurophysiol. 2010 Nov;104(5):2900-12. doi: 10.1152/jn.01082.2009. Epub 2010 Sep 1.","Blanco JA","J Neurophysiol","2010","2010/09/03","PMC2997042","","10.1152/jn.01082.2009"
"20456657","Neuronal generator patterns of olfactory event-related brain potentials in schizophrenia","Kayser J, Tenke CE, Malaspina D, Kroppmann CJ, Schaller JD, Deptula A, Gates NA, Harkavy-Friedman JM, Gil R, Bruder GE.","Psychophysiology. 2010 Nov;47(6):1075-86. doi: 10.1111/j.1469-8986.2010.01013.x.","Kayser J","Psychophysiology","2010","2010/05/12","PMC3341093","NIHMS370923","10.1111/j.1469-8986.2010.01013.x"
"20673641","Value of 3.0 T MR imaging in refractory partial epilepsy and negative 1.5 T MRI","Nguyen DK, Rochette E, Leroux JM, Beaudoin G, Cossette P, Lassonde M, Guilbert F.","Seizure. 2010 Oct;19(8):475-8. doi: 10.1016/j.seizure.2010.07.002. Epub 2010 Jul 29.","Nguyen DK","Seizure","2010","2010/08/03","","","10.1016/j.seizure.2010.07.002"
"20374541","The effects of electrode impedance on data quality and statistical significance in ERP recordings","Kappenman ES, Luck SJ.","Psychophysiology. 2010 Sep;47(5):888-904. doi: 10.1111/j.1469-8986.2010.01009.x. Epub 2010 Mar 29.","Kappenman ES","Psychophysiology","2010","2010/04/09","PMC2902592","NIHMS175138","10.1111/j.1469-8986.2010.01009.x"
"20815192","A descriptive analysis of neck myoclonus during routine polysomnography","Frauscher B, Brandauer E, Gschliesser V, Falkenstetter T, Furtner MT, Ulmer H, Poewe W, Högl B.","Sleep. 2010 Aug;33(8):1091-6. doi: 10.1093/sleep/33.8.1091.","Frauscher B","Sleep","2010","2010/09/07","PMC2910539","","10.1093/sleep/33.8.1091"
"20644919","Attention modulates motor system activation during action observation: evidence for inhibitory rebound","Schuch S, Bayliss AP, Klein C, Tipper SP.","Exp Brain Res. 2010 Aug;205(2):235-49. doi: 10.1007/s00221-010-2358-4. Epub 2010 Jul 20.","Schuch S","Exp Brain Res","2010","2010/07/21","PMC2914260","","10.1007/s00221-010-2358-4"
"20580319","Cortical and subcortical contributions to absence seizure onset examined with EEG/fMRI","Szaflarski JP, DiFrancesco M, Hirschauer T, Banks C, Privitera MD, Gotman J, Holland SK.","Epilepsy Behav. 2010 Aug;18(4):404-13. doi: 10.1016/j.yebeh.2010.05.009. Epub 2010 Jun 26.","Szaflarski JP","Epilepsy Behav","2010","2010/06/29","PMC2922486","NIHMS208993","10.1016/j.yebeh.2010.05.009"
"20362499","Suppression of deep brain stimulation artifacts from the electroencephalogram by frequency-domain Hampel filtering","Allen DP, Stegemöller EL, Zadikoff C, Rosenow JM, Mackinnon CD.","Clin Neurophysiol. 2010 Aug;121(8):1227-32. doi: 10.1016/j.clinph.2010.02.156. Epub 2010 Apr 1.","Allen DP","Clin Neurophysiol","2010","2010/04/06","PMC2924738","NIHMS194486","10.1016/j.clinph.2010.02.156"
"19945300","Comparison of spectral entropy and bispectral index electroencephalography in coronary artery bypass graft surgery","Baulig W, Seifert B, Schmid ER, Schwarz U.","J Cardiothorac Vasc Anesth. 2010 Aug;24(4):544-9. doi: 10.1053/j.jvca.2009.09.013. Epub 2009 Nov 27.","Baulig W","J Cardiothorac Vasc Anesth","2010","2009/12/01","","","10.1053/j.jvca.2009.09.013"
"20304076","Identifying robust and sensitive frequency bands for interrogating neural oscillations","Shackman AJ, McMenamin BW, Maxwell JS, Greischar LL, Davidson RJ.","Neuroimage. 2010 Jul 15;51(4):1319-33. doi: 10.1016/j.neuroimage.2010.03.037. Epub 2010 Mar 18.","Shackman AJ","Neuroimage","2010","2010/03/23","PMC2871966","NIHMS187177","10.1016/j.neuroimage.2010.03.037"
"20585148","Gaussian mixture models for classification of neonatal seizures using EEG","Thomas EM, Temko A, Lightbody G, Marnane WP, Boylan GB.","Physiol Meas. 2010 Jul;31(7):1047-64. doi: 10.1088/0967-3334/31/7/013. Epub 2010 Jun 28.","Thomas EM","Physiol Meas","2010","2010/06/30","PMC3428723","UKMS49510","10.1088/0967-3334/31/7/013"
"20578033","Electroencephalography (EEG) and event-related potentials (ERPs) with human participants","Light GA, Williams LE, Minow F, Sprock J, Rissling A, Sharp R, Swerdlow NR, Braff DL.","Curr Protoc Neurosci. 2010 Jul;Chapter 6:Unit 6.25.1-24. doi: 10.1002/0471142301.ns0625s52.","Light GA","Curr Protoc Neurosci","2010","2010/06/26","PMC2909037","NIHMS217480","10.1002/0471142301.ns0625s52"
"20210877","Measurement of mismatch negativity in individuals: a study using single-trial analysis","Bishop DV, Hardiman MJ.","Psychophysiology. 2010 Jul 1;47(4):697-705. doi: 10.1111/j.1469-8986.2009.00970.x. Epub 2010 Feb 22.","Bishop DV","Psychophysiology","2010","2010/03/10","PMC2904495","UKMS31184","10.1111/j.1469-8986.2009.00970.x"
"20565751","Extraction of single-trial cortical beta oscillatory activities in EEG signals using empirical mode decomposition","Yeh CL, Chang HC, Wu CH, Lee PL.","Biomed Eng Online. 2010 Jun 17;9:25. doi: 10.1186/1475-925X-9-25.","Yeh CL","Biomed Eng Online","2010","2010/06/23","PMC2910669","","10.1186/1475-925X-9-25"
"20522871","Neurological picture. Focal botulinum toxin injections lead to rapid resolution of myogenic artefact during EEG monitoring","Ekstein D, Shih LC, Sheen V.","J Neurol Neurosurg Psychiatry. 2010 Jun;81(6):637-8. doi: 10.1136/jnnp.2009.181446.","Ekstein D","J Neurol Neurosurg Psychiatry","2010","2010/06/05","PMC3539720","NIHMS378223","10.1136/jnnp.2009.181446"
"20410364","Removal of movement artifact from high-density EEG recorded during walking and running","Gwin JT, Gramann K, Makeig S, Ferris DP.","J Neurophysiol. 2010 Jun;103(6):3526-34. doi: 10.1152/jn.00105.2010. Epub 2010 Apr 21.","Gwin JT","J Neurophysiol","2010","2010/04/23","PMC3774587","","10.1152/jn.00105.2010"
"20074647","Removal of BCG artifacts from EEG recordings inside the MR scanner: a comparison of methodological and validation-related aspects","Vanderperren K, De Vos M, Ramautar JR, Novitskiy N, Mennes M, Assecondi S, Vanrumste B, Stiers P, Van den Bergh BR, Wagemans J, Lagae L, Sunaert S, Van Huffel S.","Neuroimage. 2010 Apr 15;50(3):920-34. doi: 10.1016/j.neuroimage.2010.01.010. Epub 2010 Jan 11.","Vanderperren K","Neuroimage","2010","2010/01/16","","","10.1016/j.neuroimage.2010.01.010"
"19823981","Physical modeling of pulse artefact sources in simultaneous EEG/fMRI","Yan WX, Mullinger KJ, Geirsdottir GB, Bowtell R.","Hum Brain Mapp. 2010 Apr;31(4):604-20. doi: 10.1002/hbm.20891.","Yan WX","Hum Brain Mapp","2010","2009/10/14","PMC6870628","","10.1002/hbm.20891"
"20365772","Dynamics of electroencephalogram entropy and pitfalls of scaling detection","Ignaccolo M, Latka M, Jernajczyk W, Grigolini P, West BJ.","Phys Rev E Stat Nonlin Soft Matter Phys. 2010 Mar;81(3 Pt 1):031909. doi: 10.1103/PhysRevE.81.031909. Epub 2010 Mar 10.","Ignaccolo M","Phys Rev E Stat Nonlin Soft Matter Phys","2010","2010/04/07","","","10.1103/PhysRevE.81.031909"
"19955019","Pitfalls of high-pass filtering for detecting epileptic oscillations: a technical note on ""false"" ripples","Bénar CG, Chauvière L, Bartolomei F, Wendling F.","Clin Neurophysiol. 2010 Mar;121(3):301-10. doi: 10.1016/j.clinph.2009.10.019. Epub 2009 Dec 1.","Bénar CG","Clin Neurophysiol","2010","2009/12/04","","","10.1016/j.clinph.2009.10.019"
"20090187","Radio frequency noise from an MLC: a feasibility study of the use of an MLC for linac-MR systems","Lamey M, Yun J, Burke B, Rathee S, Fallone BG.","Phys Med Biol. 2010 Feb 21;55(4):981-94. doi: 10.1088/0031-9155/55/4/005. Epub 2010 Jan 20.","Lamey M","Phys Med Biol","2010","2010/01/22","PMC2910753","CAMS1345","10.1088/0031-9155/55/4/005"
"20063319","MEG detection of delayed auditory evoked responses in autism spectrum disorders: towards an imaging biomarker for autism","Roberts TP, Khan SY, Rey M, Monroe JF, Cannon K, Blaskey L, Woldoff S, Qasmieh S, Gandal M, Schmidt GL, Zarnow DM, Levy SE, Edgar JC.","Autism Res. 2010 Feb;3(1):8-18. doi: 10.1002/aur.111.","Roberts TP","Autism Res","2010","2010/01/12","PMC3099241","NIHMS268847","10.1002/aur.111"
"20032241","Rectification of the EMG signal impairs the identification of oscillatory input to the muscle","Neto OP, Christou EA.","J Neurophysiol. 2010 Feb;103(2):1093-103. doi: 10.1152/jn.00792.2009. Epub 2009 Dec 23.","Neto OP","J Neurophysiol","2010","2009/12/25","PMC2822682","","10.1152/jn.00792.2009"
"19892021","Good practices in EEG-MRI: the utility of retrospective synchronization and PCA for the removal of MRI gradient artefacts","Mandelkow H, Brandeis D, Boesiger P.","Neuroimage. 2010 Feb 1;49(3):2287-303. doi: 10.1016/j.neuroimage.2009.10.050. Epub 2009 Nov 3.","Mandelkow H","Neuroimage","2010","2009/11/07","","","10.1016/j.neuroimage.2009.10.050"
"19833218","Validation of ICA-based myogenic artifact correction for scalp and source-localized EEG","McMenamin BW, Shackman AJ, Maxwell JS, Bachhuber DR, Koppenhaver AM, Greischar LL, Davidson RJ.","Neuroimage. 2010 Feb 1;49(3):2416-32. doi: 10.1016/j.neuroimage.2009.10.010. Epub 2009 Oct 13.","McMenamin BW","Neuroimage","2010","2009/10/17","PMC2818255","NIHMS150978","10.1016/j.neuroimage.2009.10.010"
"19662656","Correction for pulse height variability reduces physiological noise in functional MRI when studying spontaneous brain activity","van Houdt PJ, Ossenblok PP, Boon PA, Leijten FS, Velis DN, Stam CJ, de Munck JC.","Hum Brain Mapp. 2010 Feb;31(2):311-25. doi: 10.1002/hbm.20866.","van Houdt PJ","Hum Brain Mapp","2010","2009/08/08","PMC6870885","","10.1002/hbm.20866"
"22315542","Improving the response of accelerometers for automotive applications by using LMS adaptive filters","Hernandez W, de Vicente J, Sergiyenko O, Fernández E.","Sensors (Basel). 2010;10(1):313-29. doi: 10.3390/s100100313. Epub 2009 Dec 31.","Hernandez W","Sensors (Basel)","2010","2012/02/09","PMC3270843","","10.3390/s100100313"
"21792383","Spectral pattern analysis of propofol induced spindle oscillations in the presence of auditory stimulations","Ozgoren M, Bayazit O, Gokmen N, Oniz A.","Open Neuroimag J. 2010;4:121-9. doi: 10.2174/1874440001004010121. Epub 2010 Sep 8.","Ozgoren M","Open Neuroimag J","2010","2011/07/28","PMC3141347","","10.2174/1874440001004010121"
"21096544","Improving phase congruency for EEG data reduction","Logesparan L, Rodriguez-Villegas E.","Annu Int Conf IEEE Eng Med Biol Soc. 2010;2010:642-5. doi: 10.1109/IEMBS.2010.5627244.","Logesparan L","Annu Int Conf IEEE Eng Med Biol Soc","2010","2010/11/25","","","10.1109/IEMBS.2010.5627244"
"20383278","Brain responses evoked by high-frequency repetitive transcranial magnetic stimulation: an event-related potential study","Hamidi M, Slagter HA, Tononi G, Postle BR.","Brain Stimul. 2010 Jan;3(1):2-14. doi: 10.1016/j.brs.2009.04.001.","Hamidi M","Brain Stimul","2010","2010/04/13","PMC2850212","NIHMS111661","10.1016/j.brs.2009.04.001"
"20012350","Methodology for combined TMS and EEG","Ilmoniemi RJ, Kicić D.","Brain Topogr. 2010 Jan;22(4):233-48. doi: 10.1007/s10548-009-0123-4. Epub 2009 Dec 10.","Ilmoniemi RJ","Brain Topogr","2010","2009/12/17","PMC2800178","","10.1007/s10548-009-0123-4"
"19647798","Independent component analysis reveals dynamic ictal BOLD responses in EEG-fMRI data from focal epilepsy patients","LeVan P, Tyvaert L, Moeller F, Gotman J.","Neuroimage. 2010 Jan 1;49(1):366-78. doi: 10.1016/j.neuroimage.2009.07.064. Epub 2009 Aug 6.","LeVan P","Neuroimage","2010","2009/08/04","PMC3779215","CAMS3408","10.1016/j.neuroimage.2009.07.064"
"19900285","Single-trial classification of NIRS signals during emotional induction tasks: towards a corporeal machine interface","Tai K, Chau T.","J Neuroeng Rehabil. 2009 Nov 9;6:39. doi: 10.1186/1743-0003-6-39.","Tai K","J Neuroeng Rehabil","2009","2009/11/11","PMC2779792","","10.1186/1743-0003-6-39"
"19818944","Magnetoencephalographic analysis in patients with vagus nerve stimulator","Tanaka N, Thiele EA, Madsen JR, Bourgeois BF, Stufflebeam SM.","Pediatr Neurol. 2009 Nov;41(5):383-7. doi: 10.1016/j.pediatrneurol.2009.06.007.","Tanaka N","Pediatr Neurol","2009","2009/10/13","PMC2761246","NIHMS133809","10.1016/j.pediatrneurol.2009.06.007"
"19695985","Detection of discontinuous patterns in spontaneous brain activity of neonates and fetuses","Vairavan S, Eswaran H, Haddad N, Rose DF, Preissl H, Wilson JD, Lowery CL, Govindan RB.","IEEE Trans Biomed Eng. 2009 Nov;56(11 Pt 2):2725-9. doi: 10.1109/TBME.2009.2028875. Epub 2009 Aug 18.","Vairavan S","IEEE Trans Biomed Eng","2009","2009/08/22","PMC2947836","NIHMS238314","10.1109/TBME.2009.2028875"
"19580873","Development, validation, and comparison of ICA-based gradient artifact reduction algorithms for simultaneous EEG-spiral in/out and echo-planar fMRI recordings","Ryali S, Glover GH, Chang C, Menon V.","Neuroimage. 2009 Nov 1;48(2):348-61. doi: 10.1016/j.neuroimage.2009.06.072. Epub 2009 Jul 4.","Ryali S","Neuroimage","2009","2009/07/08","PMC2745974","NIHMS130469","10.1016/j.neuroimage.2009.06.072"
"19807920","Electroencephalographic correlates of Chronic Fatigue Syndrome","Decker MJ, Tabassum H, Lin JM, Reeves WC.","Behav Brain Funct. 2009 Oct 6;5:43. doi: 10.1186/1744-9081-5-43.","Decker MJ","Behav Brain Funct","2009","2009/10/08","PMC2765956","","10.1186/1744-9081-5-43"
"19365799","Simultaneously recorded EEG-fMRI: removal of gradient artifacts by subtraction of head movement related average artifact waveforms","Sun L, Hinrichs H.","Hum Brain Mapp. 2009 Oct;30(10):3361-77. doi: 10.1002/hbm.20758.","Sun L","Hum Brain Mapp","2009","2009/04/15","PMC6870712","","10.1002/hbm.20758"
"19172631","A method for accurate group difference detection by constraining the mixing coefficients in an ICA framework","Sui J, Adali T, Pearlson GD, Clark VP, Calhoun VD.","Hum Brain Mapp. 2009 Sep;30(9):2953-70. doi: 10.1002/hbm.20721.","Sui J","Hum Brain Mapp","2009","2009/01/28","PMC2733923","NIHMS98775","10.1002/hbm.20721"
"19682385","Extracting complexity waveforms from one-dimensional signals","Kalauzi A, Bojić T, Rakić L.","Nonlinear Biomed Phys. 2009 Aug 14;3(1):8. doi: 10.1186/1753-4631-3-8.","Kalauzi A","Nonlinear Biomed Phys","2009","2009/08/18","PMC2739215","","10.1186/1753-4631-3-8"
"20234848","GENERALIZED SIDELOBE CANCELLER FOR MAGNETOENCEPHALOGRAPHY ARRAYS","Mosher JC, Hämäläinen MS, Pantazis D, Hui HB, Burgess RC, Leahy RM.","Proc IEEE Int Symp Biomed Imaging. 2009 Aug 7;2009:149-152. doi: 10.1109/ISBI.2009.5193005.","Mosher JC","Proc IEEE Int Symp Biomed Imaging","2009","2010/03/18","PMC2838207","NIHMS164379","10.1109/ISBI.2009.5193005"
"19602985","A multistage system for the automated detection of epileptic seizures in neonatal electroencephalography","Mitra J, Glover JR, Ktonas PY, Thitai Kumar A, Mukherjee A, Karayiannis NB, Frost JD Jr, Hrachovy RA, Mizrahi EM.","J Clin Neurophysiol. 2009 Aug;26(4):218-26. doi: 10.1097/WNP.0b013e3181b2f29d.","Mitra J","J Clin Neurophysiol","2009","2009/07/16","PMC2760540","NIHMS139870","10.1097/WNP.0b013e3181b2f29d"
"19539525","Removing muscle and eye artifacts using blind source separation techniques in ictal EEG source imaging","Hallez H, De Vos M, Vanrumste B, Van Hese P, Assecondi S, Van Laere K, Dupont P, Van Paesschen W, Van Huffel S, Lemahieu I.","Clin Neurophysiol. 2009 Jul;120(7):1262-72. doi: 10.1016/j.clinph.2009.05.010. Epub 2009 Jun 17.","Hallez H","Clin Neurophysiol","2009","2009/06/23","","","10.1016/j.clinph.2009.05.010"
"19264143","Signal quality of simultaneously recorded invasive and non-invasive EEG","Ball T, Kern M, Mutschler I, Aertsen A, Schulze-Bonhage A.","Neuroimage. 2009 Jul 1;46(3):708-16. doi: 10.1016/j.neuroimage.2009.02.028. Epub 2009 Mar 2.","Ball T","Neuroimage","2009","2009/03/07","","","10.1016/j.neuroimage.2009.02.028"
"18726909","Independent component analysis as a model-free approach for the detection of BOLD changes related to epileptic spikes: a simulation study","LeVan P, Gotman J.","Hum Brain Mapp. 2009 Jul;30(7):2021-31. doi: 10.1002/hbm.20647.","LeVan P","Hum Brain Mapp","2009","2008/08/30","PMC3792083","CAMS3467","10.1002/hbm.20647"
"19375455","Graphical modelling for brain connectivity via partial coherence","Medkour T, Walden AT, Burgess A.","J Neurosci Methods. 2009 Jun 15;180(2):374-83. doi: 10.1016/j.jneumeth.2009.04.003. Epub 2009 Apr 16.","Medkour T","J Neurosci Methods","2009","2009/04/21","","","10.1016/j.jneumeth.2009.04.003"
"22563305","A Highly Backdrivable, Lightweight Knee Actuator for Investigating Gait in Stroke","Sulzer JS, Roiz RA, Peshkin MA, Patton JL.","IEEE Trans Robot. 2009 Jun;25(3):539-548. doi: 10.1109/TRO.2009.2019788.","Sulzer JS","IEEE Trans Robot","2009","2012/05/08","PMC3342704","NIHMS355470","10.1109/TRO.2009.2019788"
