PMID,Title,Authors,Citation,First Author,Journal/Book,Publication Year,Create Date,PMCID,NIHMS ID,DOI
"32205896","Improving EEG Muscle Artifact Removal With an EMG Array","Mucarquer JA, Prado P, Escobar MJ, El-Deredy W, Zañartu M.","IEEE Trans Instrum Meas. 2020 Mar;69(3):815-824. doi: 10.1109/tim.2019.2906967. Epub 2019 May 1.","Mucarquer JA","IEEE Trans Instrum Meas","2020","2020/03/25","PMC7088455","NIHMS1069549","10.1109/tim.2019.2906967"
"31199248","Faster Gait Speeds Reduce Alpha and Beta EEG Spectral Power From Human Sensorimotor Cortex","Nordin AD, Hairston WD, Ferris DP.","IEEE Trans Biomed Eng. 2020 Mar;67(3):842-853. doi: 10.1109/TBME.2019.2921766. Epub 2019 Jun 13.","Nordin AD","IEEE Trans Biomed Eng","2020","2019/06/15","PMC7134343","NIHMS1565487","10.1109/TBME.2019.2921766"
"31180831","Early Detection of Human Epileptic Seizures Based on Intracortical Microelectrode Array Signals","Park YS, Cosgrove GR, Madsen JR, Eskandar EN, Hochberg LR, Cash SS, Truccolo W.","IEEE Trans Biomed Eng. 2020 Mar;67(3):817-831. doi: 10.1109/TBME.2019.2921448. Epub 2019 Jun 6.","Park YS","IEEE Trans Biomed Eng","2020","2019/06/11","PMC7067044","NIHMS1565486","10.1109/TBME.2019.2921448"
"32076045","Corticomuscular control of walking in older people and people with Parkinson's disease","Roeder L, Boonstra TW, Kerr GK.","Sci Rep. 2020 Feb 19;10(1):2980. doi: 10.1038/s41598-020-59810-w.","Roeder L","Sci Rep","2020","2020/02/21","PMC7031238","","10.1038/s41598-020-59810-w"
"31786167","ZapLine: A simple and effective method to remove power line artifacts","de Cheveigné A.","Neuroimage. 2020 Feb 15;207:116356. doi: 10.1016/j.neuroimage.2019.116356. Epub 2019 Nov 28.","de Cheveigné A","Neuroimage","2020","2019/12/02","","","10.1016/j.neuroimage.2019.116356"
"31689537","Optimizing the ICA-based removal of ocular EEG artifacts from free viewing experiments","Dimigen O.","Neuroimage. 2020 Feb 15;207:116117. doi: 10.1016/j.neuroimage.2019.116117. Epub 2019 Nov 2.","Dimigen O","Neuroimage","2020","2019/11/06","","","10.1016/j.neuroimage.2019.116117"
"32130173","Detection of Postictal Generalized Electroencephalogram Suppression: Random Forest Approach","Li X, Tao S, Jamal-Omidi S, Huang Y, Lhatoo SD, Zhang GQ, Cui L.","JMIR Med Inform. 2020 Feb 14;8(2):e17061. doi: 10.2196/17061.","Li X","JMIR Med Inform","2020","2020/03/05","PMC7055778","","10.2196/17061"
"31951604","A brain connectivity characterization of children with different levels of mathematical achievement based on graph metrics","Torres-Ramos S, Salido-Ruiz RA, Espinoza-Valdez A, Gómez-Velázquez FR, González-Garrido AA, Román-Godínez I.","PLoS One. 2020 Jan 17;15(1):e0227613. doi: 10.1371/journal.pone.0227613. eCollection 2020.","Torres-Ramos S","PLoS One","2020","2020/01/18","PMC6968862","","10.1371/journal.pone.0227613"
"31705936","Adaptive spike-artifact removal from local field potentials uncovers prominent beta and gamma band neuronal synchronization","Banaie Boroujeni K, Tiesinga P, Womelsdorf T.","J Neurosci Methods. 2020 Jan 15;330:108485. doi: 10.1016/j.jneumeth.2019.108485. Epub 2019 Nov 6.","Banaie Boroujeni K","J Neurosci Methods","2020","2019/11/10","PMC7242114","NIHMS1543288","10.1016/j.jneumeth.2019.108485"
"31760212","Detection of mesial temporal lobe epileptiform discharges on intracranial electrodes using deep learning","Abou Jaoude M, Jing J, Sun H, Jacobs CS, Pellerin KR, Westover MB, Cash SS, Lam AD.","Clin Neurophysiol. 2020 Jan;131(1):133-141. doi: 10.1016/j.clinph.2019.09.031. Epub 2019 Nov 11.","Abou Jaoude M","Clin Neurophysiol","2020","2019/11/25","PMC6879011","NIHMS1542684","10.1016/j.clinph.2019.09.031"
"31546052","Stimulus-aware spatial filtering for single-trial neural response and temporal response function estimation in high-density EEG with applications in auditory research","Das N, Vanthornhout J, Francart T, Bertrand A.","Neuroimage. 2020 Jan 1;204:116211. doi: 10.1016/j.neuroimage.2019.116211. Epub 2019 Sep 20.","Das N","Neuroimage","2020","2019/09/24","PMC7355237","","10.1016/j.neuroimage.2019.116211"
"31290050","EEG Artifact Removal in TMS Studies of Cortical Speech Areas","Salo KS, Mutanen TP, Vaalto SMI, Ilmoniemi RJ.","Brain Topogr. 2020 Jan;33(1):1-9. doi: 10.1007/s10548-019-00724-w. Epub 2019 Jul 9.","Salo KS","Brain Topogr","2020","2019/07/11","PMC6943412","","10.1007/s10548-019-00724-w"
"31976053","Removal of EMG Artifacts from Multichannel EEG Signals Using Combined Singular Spectrum Analysis and Canonical Correlation Analysis","Liu Q, Liu A, Zhang X, Chen X, Qian R, Chen X.","J Healthc Eng. 2019 Dec 30;2019:4159676. doi: 10.1155/2019/4159676. eCollection 2019.","Liu Q","J Healthc Eng","2019","2020/01/25","PMC6955116","","10.1155/2019/4159676"
"31920594","Music Improvisation Is Characterized by Increase EEG Spectral Power in Prefrontal and Perceptual Motor Cortical Sources and Can be Reliably Classified From Non-improvisatory Performance","Sasaki M, Iversen J, Callan DE.","Front Hum Neurosci. 2019 Dec 10;13:435. doi: 10.3389/fnhum.2019.00435. eCollection 2019.","Sasaki M","Front Hum Neurosci","2019","2020/01/11","PMC6915035","","10.3389/fnhum.2019.00435"
"31817120","Improved EOG Artifact Removal Using Wavelet Enhanced Independent Component Analysis","Issa MF, Juhasz Z.","Brain Sci. 2019 Dec 4;9(12):355. doi: 10.3390/brainsci9120355.","Issa MF","Brain Sci","2019","2019/12/11","PMC6956025","","10.3390/brainsci9120355"
"31810263","Low Complexity Automatic Stationary Wavelet Transform for Elimination of Eye Blinks from EEG","Shahbakhti M, Maugeon M, Beiramvand M, Marozas V.","Brain Sci. 2019 Dec 2;9(12):352. doi: 10.3390/brainsci9120352.","Shahbakhti M","Brain Sci","2019","2019/12/08","PMC6955982","","10.3390/brainsci9120352"
"31938006","Differences in motivation during the bench press movement with progressive loads using EEG analysis","Maszczyk A, Dobrakowski P, Żak M, Gozdowski P, Krawczyk M, Małecki A, Stastny P, Zajac T.","Biol Sport. 2019 Dec;36(4):351-356. doi: 10.5114/biolsport.2019.88757. Epub 2019 Oct 31.","Maszczyk A","Biol Sport","2019","2020/01/16","PMC6945046","","10.5114/biolsport.2019.88757"
"30821056","Intra-individual stability of NREM sleep quantitative EEG measures in obstructive sleep apnea","Poon JJY, Chapman JL, Wong KKH, Mullins AE, Cho G, Kim JW, Yee BJ, Grunstein RR, Marshall NS, D'Rozario AL.","J Sleep Res. 2019 Dec;28(6):e12838. doi: 10.1111/jsr.12838. Epub 2019 Mar 1.","Poon JJY","J Sleep Res","2019","2019/03/02","","","10.1111/jsr.12838"
"31795398","Peak Detection with Online Electroencephalography (EEG) Artifact Removal for Brain-Computer Interface (BCI) Purposes","Benda M, Volosyak I.","Brain Sci. 2019 Nov 29;9(12):347. doi: 10.3390/brainsci9120347.","Benda M","Brain Sci","2019","2019/12/05","PMC6955994","","10.3390/brainsci9120347"
"31849630","Optimization of Real-Time EEG Artifact Removal and Emotion Estimation for Human-Robot Interaction Applications","Val-Calvo M, Álvarez-Sánchez JR, Ferrández-Vicente JM, Fernández E.","Front Comput Neurosci. 2019 Nov 26;13:80. doi: 10.3389/fncom.2019.00080. eCollection 2019.","Val-Calvo M","Front Comput Neurosci","2019","2019/12/19","PMC6889828","","10.3389/fncom.2019.00080"
"31717412","Classification of Motor Functions from Electroencephalogram (EEG) Signals Based on an Integrated Method Comprised of Common Spatial Pattern and Wavelet Transform Framework","Yahya N, Musa H, Ong ZY, Elamvazuthi I.","Sensors (Basel). 2019 Nov 8;19(22):4878. doi: 10.3390/s19224878.","Yahya N","Sensors (Basel)","2019","2019/11/14","PMC6891287","","10.3390/s19224878"
"31592545","Cardiac biomarkers associated with epilepsy in a captive baboon pedigree","Szabó CÁ, Akopian M, González DA, de la Garza MA, Carless MA.","Epilepsia. 2019 Nov;60(11):e110-e114. doi: 10.1111/epi.16359. Epub 2019 Oct 8.","Szabó CÁ","Epilepsia","2019","2019/10/09","PMC7054851","NIHMS1554003","10.1111/epi.16359"
"31615138","Artifacts in Simultaneous hdEEG/fMRI Imaging: A Nonlinear Dimensionality Reduction Approach","Piorecky M, Koudelka V, Strobl J, Brunovsky M, Krajca V.","Sensors (Basel). 2019 Oct 14;19(20):4454. doi: 10.3390/s19204454.","Piorecky M","Sensors (Basel)","2019","2019/10/17","PMC6832374","","10.3390/s19204454"
"31601069","Automatic eye blink artifact removal for EEG based on a sparse coding technique for assessing major mental disorders","Zafar R, Qayyum A, Mumtaz W.","J Integr Neurosci. 2019 Sep 30;18(3):217-229. doi: 10.31083/j.jin.2019.03.164.","Zafar R","J Integr Neurosci","2019","2019/10/12","","","10.31083/j.jin.2019.03.164"
"31619953","Dry EEG in Sports Sciences: A Fast and Reliable Tool to Assess Individual Alpha Peak Frequency Changes Induced by Physical Effort","di Fronso S, Fiedler P, Tamburro G, Haueisen J, Bertollo M, Comani S.","Front Neurosci. 2019 Sep 20;13:982. doi: 10.3389/fnins.2019.00982. eCollection 2019.","di Fronso S","Front Neurosci","2019","2019/10/18","PMC6763587","","10.3389/fnins.2019.00982"
"31551695","Evaluating Mental Load During Realistic Driving Simulations by Means of Round the Ear Electrodes","Wascher E, Arnau S, Reiser JE, Rudinger G, Karthaus M, Rinkenauer G, Dreger F, Getzmann S.","Front Neurosci. 2019 Sep 4;13:940. doi: 10.3389/fnins.2019.00940. eCollection 2019.","Wascher E","Front Neurosci","2019","2019/09/26","PMC6737043","","10.3389/fnins.2019.00940"
"31543766","The Sensitivity of Single-Trial Mu-Suppression Detection for Motor Imagery Performance as Compared to Motor Execution and Motor Observation Performance","Xu K, Huang YY, Duann JR.","Front Hum Neurosci. 2019 Aug 30;13:302. doi: 10.3389/fnhum.2019.00302. eCollection 2019.","Xu K","Front Hum Neurosci","2019","2019/09/24","PMC6728805","","10.3389/fnhum.2019.00302"
"31534448","Wavelet-Based Semblance Methods to Enhance the Single-Trial Detection of Event-Related Potentials for a BCI Spelling System","Saavedra C, Salas R, Bougrain L.","Comput Intell Neurosci. 2019 Aug 26;2019:8432953. doi: 10.1155/2019/8432953. eCollection 2019.","Saavedra C","Comput Intell Neurosci","2019","2019/09/20","PMC6732649","","10.1155/2019/8432953"
"31474842","Encoding Pleasant and Unpleasant Expression of the Architectural Window Shapes: An ERP Study","Naghibi Rad P, Shahroudi AA, Shabani H, Ajami S, Lashgari R.","Front Behav Neurosci. 2019 Aug 16;13:186. doi: 10.3389/fnbeh.2019.00186. eCollection 2019.","Naghibi Rad P","Front Behav Neurosci","2019","2019/09/03","PMC6707382","","10.3389/fnbeh.2019.00186"
"31366449","Bilateral synchronous gamma range firing of bulbar motor units during tonic seizures","Zwarts M, van Erp G, van Dijk H.","Epileptic Disord. 2019 Aug 1;21(4):385-388. doi: 10.1684/epd.2019.1088.","Zwarts M","Epileptic Disord","2019","2019/08/02","","","10.1684/epd.2019.1088"
"30732457","New-Onset Alzheimer's Disease and Normal Subjects 100% Differentiated by P300","Jervis BW, Bigan C, Jervis MW, Besleaga M.","Am J Alzheimers Dis Other Demen. 2019 Aug;34(5):308-313. doi: 10.1177/1533317519828101. Epub 2019 Feb 7.","Jervis BW","Am J Alzheimers Dis Other Demen","2019","2019/02/09","","","10.1177/1533317519828101"
"30311707","NREM sleep EEG slow waves in autistic and typically developing children: Morphological characteristics and scalp distribution","Lehoux T, Carrier J, Godbout R.","J Sleep Res. 2019 Aug;28(4):e12775. doi: 10.1111/jsr.12775. Epub 2018 Oct 12.","Lehoux T","J Sleep Res","2019","2018/10/13","","","10.1111/jsr.12775"
"28532853","Long-term test-retest reliability of event-related potential (ERP) recordings during treadmill walking using the mobile brain/body imaging (MoBI) approach","Malcolm BR, Foxe JJ, Butler JS, Mowrey WB, Molholm S, De Sanctis P.","Brain Res. 2019 Aug 1;1716:62-69. doi: 10.1016/j.brainres.2017.05.021. Epub 2017 May 19.","Malcolm BR","Brain Res","2019","2017/05/24","PMC7209996","NIHMS881363","10.1016/j.brainres.2017.05.021"
"30951848","Eye movements explain decodability during perception and cued attention in MEG","Quax SC, Dijkstra N, van Staveren MJ, Bosch SE, van Gerven MAJ.","Neuroimage. 2019 Jul 15;195:444-453. doi: 10.1016/j.neuroimage.2019.03.069. Epub 2019 Apr 3.","Quax SC","Neuroimage","2019","2019/04/06","","","10.1016/j.neuroimage.2019.03.069"
"31354408","Simultaneous EEG-fMRI: Evaluating the Effect of the EEG Cap-Cabling Configuration on the Gradient Artifact","Chowdhury MEH, Khandakar A, Mullinger KJ, Al-Emadi N, Bowtell R.","Front Neurosci. 2019 Jul 10;13:690. doi: 10.3389/fnins.2019.00690. eCollection 2019.","Chowdhury MEH","Front Neurosci","2019","2019/07/30","PMC6635558","","10.3389/fnins.2019.00690"
"31295908","Analyzing Passive BCI Signals to Control Adaptive Automation Devices","Al-Hudhud G, Alqahtani L, Albaity H, Alsaeed D, Al-Turaiki I.","Sensors (Basel). 2019 Jul 10;19(14):3042. doi: 10.3390/s19143042.","Al-Hudhud G","Sensors (Basel)","2019","2019/07/13","PMC6678787","","10.3390/s19143042"
"31945852","Data-driven separation and estimation of atrial dynamics in very high-dimensional electrocardiograms from epilepsy patients","Stamoulis C, Connoly J, Duffy FH.","Annu Int Conf IEEE Eng Med Biol Soc. 2019 Jul;2019:91-94. doi: 10.1109/EMBC.2019.8856494.","Stamoulis C","Annu Int Conf IEEE Eng Med Biol Soc","2019","2020/01/18","PMC6986805","NIHMS1065594","10.1109/EMBC.2019.8856494"
"31189384","Biomarkers for SUDEP: Are We There Yet?","King-Stephens D.","Epilepsy Curr. 2019 Jul-Aug;19(4):231-233. doi: 10.1177/1535759719855948. Epub 2019 Jun 13.","King-Stephens D","Epilepsy Curr","2019","2019/06/14","PMC6891836","","10.1177/1535759719855948"
"31021800","Hemicraniectomy in Traumatic Brain Injury: A Noninvasive Platform to Investigate High Gamma Activity for Brain Machine Interfaces","Vaidya M, Flint RD, Wang PT, Barry A, Li Y, Ghassemi M, Tomic G, Yao J, Carmona C, Mugler EM, Gallick S, Driver S, Brkic N, Ripley D, Liu C, Kamper D, Do AH, Slutzky MW.","IEEE Trans Neural Syst Rehabil Eng. 2019 Jul;27(7):1467-1472. doi: 10.1109/TNSRE.2019.2912298. Epub 2019 Apr 23.","Vaidya M","IEEE Trans Neural Syst Rehabil Eng","2019","2019/04/26","PMC7577111","NIHMS1533893","10.1109/TNSRE.2019.2912298"
"31015102","Abnormal visual sensitivity in eyelid myoclonia with absences: Evidence from electrocortical connectivity and non-linear quantitative analysis of EEG signal","Giuliano L, Mostile G, Fatuzzo D, Mainieri G, Nicoletti A, Sofia V, Zappia M.","Seizure. 2019 Jul;69:118-124. doi: 10.1016/j.seizure.2019.04.007. Epub 2019 Apr 10.","Giuliano L","Seizure","2019","2019/04/25","","","10.1016/j.seizure.2019.04.007"
"30972605","The Statistics of EEG Unipolar References: Derivations and Properties","Hu S, Yao D, Bringas-Vega ML, Qin Y, Valdes-Sosa PA.","Brain Topogr. 2019 Jul;32(4):696-703. doi: 10.1007/s10548-019-00706-y. Epub 2019 Apr 10.","Hu S","Brain Topogr","2019","2019/04/12","PMC6592964","","10.1007/s10548-019-00706-y"
"31482052","High Frequency Oscillations in Epilepsy: Detection Methods and Considerations in Clinical Application","Park CJ, Hong SB.","J Epilepsy Res. 2019 Jun 30;9(1):1-13. doi: 10.14581/jer.19001. eCollection 2019 Jun.","Park CJ","J Epilepsy Res","2019","2019/09/05","PMC6706641","","10.14581/jer.19001"
"31346330","Functional Corticomuscular Signal Coupling Is Weakened during Voluntary Motor Action in Cancer-Related Fatigue","Jiang C, Yang Q, Chen T, Siemionow V, Ranganathan VK, Yan AF, Yue GH.","Neural Plast. 2019 Jun 26;2019:2490750. doi: 10.1155/2019/2490750. eCollection 2019.","Jiang C","Neural Plast","2019","2019/07/27","PMC6617923","","10.1155/2019/2490750"
"31258465","L-Dopa Modulation of Brain Connectivity in Parkinson's Disease Patients: A Pilot EEG-fMRI Study","Evangelisti S, Pittau F, Testa C, Rizzo G, Gramegna LL, Ferri L, Coito A, Cortelli P, Calandra-Buonaura G, Bisquoli F, Bianchini C, Manners DN, Talozzi L, Tonon C, Lodi R, Tinuper P.","Front Neurosci. 2019 Jun 14;13:611. doi: 10.3389/fnins.2019.00611. eCollection 2019.","Evangelisti S","Front Neurosci","2019","2019/07/02","PMC6587436","","10.3389/fnins.2019.00611"
"31212613","Analysis of a Low-Cost EEG Monitoring System and Dry Electrodes toward Clinical Use in the Neonatal ICU","O'Sullivan M, Temko A, Bocchino A, O'Mahony C, Boylan G, Popovici E.","Sensors (Basel). 2019 Jun 11;19(11):2637. doi: 10.3390/s19112637.","O'Sullivan M","Sensors (Basel)","2019","2019/06/20","PMC6603568","","10.3390/s19112637"
"31181744","The Effects of Filter's Class, Cutoff Frequencies, and Independent Component Analysis on the Amplitude of Somatosensory Evoked Potentials Recorded from Healthy Volunteers","Navid MS, Niazi IK, Lelic D, Drewes AM, Haavik H.","Sensors (Basel). 2019 Jun 8;19(11):2610. doi: 10.3390/s19112610.","Navid MS","Sensors (Basel)","2019","2019/06/12","PMC6603557","","10.3390/s19112610"
"31003116","Redaction of false high frequency oscillations due to muscle artifact improves specificity to epileptic tissue","Ren S, Gliske SV, Brang D, Stacey WC.","Clin Neurophysiol. 2019 Jun;130(6):976-985. doi: 10.1016/j.clinph.2019.03.028. Epub 2019 Apr 11.","Ren S","Clin Neurophysiol","2019","2019/04/20","PMC6551620","NIHMS1526836","10.1016/j.clinph.2019.03.028"
"30989095","Dataset of 24-subject EEG recordings during viewing of real-world objects and planar images of the same items","Marini F, Breeding KA, Snow JC.","Data Brief. 2019 Mar 21;24:103857. doi: 10.1016/j.dib.2019.103857. eCollection 2019 Jun.","Marini F","Data Brief","2019","2019/04/17","PMC6446127","","10.1016/j.dib.2019.103857"
"30369431","Adaptive and Wireless Recordings of Electrophysiological Signals During Concurrent Magnetic Resonance Imaging","Mandal R, Babaria N, Jiayue Cao, Zhongming Liu.","IEEE Trans Biomed Eng. 2019 Jun;66(6):1649-1657. doi: 10.1109/TBME.2018.2877640. Epub 2018 Oct 23.","Mandal R","IEEE Trans Biomed Eng","2019","2018/10/30","PMC6544149","NIHMS1529891","10.1109/TBME.2018.2877640"
"31239837","Steady-State Motion Visual Evoked Potential (SSMVEP) Enhancement Method Based on Time-Frequency Image Fusion","Yan W, Xu G, Chen L, Zheng X.","Comput Intell Neurosci. 2019 May 21;2019:9439407. doi: 10.1155/2019/9439407. eCollection 2019.","Yan W","Comput Intell Neurosci","2019","2019/06/27","PMC6556311","","10.1155/2019/9439407"
"31109062","An Unsupervised Method for Artefact Removal in EEG Signals","Mur A, Dormido R, Duro N.","Sensors (Basel). 2019 May 18;19(10):2302. doi: 10.3390/s19102302.","Mur A","Sensors (Basel)","2019","2019/05/22","PMC6567218","","10.3390/s19102302"
"31133785","Automatic Removal of Cardiac Interference (ARCI): A New Approach for EEG Data","Tamburro G, Stone DB, Comani S.","Front Neurosci. 2019 May 8;13:441. doi: 10.3389/fnins.2019.00441. eCollection 2019.","Tamburro G","Front Neurosci","2019","2019/05/29","PMC6517508","","10.3389/fnins.2019.00441"
"31105543","A Riemannian Modification of Artifact Subspace Reconstruction for EEG Artifact Handling","Blum S, Jacobsen NSJ, Bleichner MG, Debener S.","Front Hum Neurosci. 2019 Apr 26;13:141. doi: 10.3389/fnhum.2019.00141. eCollection 2019.","Blum S","Front Hum Neurosci","2019","2019/05/21","PMC6499032","","10.3389/fnhum.2019.00141"
"31028046","Transduction of the Geomagnetic Field as Evidenced from alpha-Band Activity in the Human Brain","Wang CX, Hilburn IA, Wu DA, Mizuhara Y, Cousté CP, Abrahams JNH, Bernstein SE, Matani A, Shimojo S, Kirschvink JL.","eNeuro. 2019 Apr 26;6(2):ENEURO.0483-18.2019. doi: 10.1523/ENEURO.0483-18.2019. Print 2019 Mar/Apr.","Wang CX","eNeuro","2019","2019/04/28","PMC6494972","","10.1523/ENEURO.0483-18.2019"
"31024278","fNIRS Evidence for Recognizably Different Positive Emotions","Hu X, Zhuang C, Wang F, Liu YJ, Im CH, Zhang D.","Front Hum Neurosci. 2019 Apr 9;13:120. doi: 10.3389/fnhum.2019.00120. eCollection 2019.","Hu X","Front Hum Neurosci","2019","2019/04/27","PMC6465574","","10.3389/fnhum.2019.00120"
"30965564","An EEG-Based Identity Authentication System with Audiovisual Paradigm in IoT","Huang H, Hu L, Xiao F, Du A, Ye N, He F.","Sensors (Basel). 2019 Apr 8;19(7):1664. doi: 10.3390/s19071664.","Huang H","Sensors (Basel)","2019","2019/04/11","PMC6479387","","10.3390/s19071664"
"30822768","Simultaneous EIT and EEG using frequency division multiplexing","Avery J, Dowrick T, Witkowska-Wrobel A, Faulkner M, Aristovich K, Holder D.","Physiol Meas. 2019 Apr 3;40(3):034007. doi: 10.1088/1361-6579/ab0bbc.","Avery J","Physiol Meas","2019","2019/03/02","","","10.1088/1361-6579/ab0bbc"
"30943762","Expandable Lattice Electrode Ablation Catheter: A Novel Radiofrequency Platform Allowing High Current at Low Density for Rapid, Titratable, and Durable Lesions","Barkagan M, Leshem E, Rottmann M, Sroubek J, Shapira-Daniels A, Anter E.","Circ Arrhythm Electrophysiol. 2019 Apr;12(4):e007090. doi: 10.1161/CIRCEP.118.007090.","Barkagan M","Circ Arrhythm Electrophysiol","2019","2019/04/05","PMC6652200","NIHMS1522526","10.1161/CIRCEP.118.007090"
"30738105","Vibrotactile piezoelectric stimulation system with precise and versatile timing control for somatosensory research","Sun L, Okada Y.","J Neurosci Methods. 2019 Apr 1;317:29-36. doi: 10.1016/j.jneumeth.2019.02.002. Epub 2019 Feb 7.","Sun L","J Neurosci Methods","2019","2019/02/10","PMC6588181","NIHMS1521343","10.1016/j.jneumeth.2019.02.002"
"30639330","Reducing power line noise in EEG and MEG data via spectrum interpolation","Leske S, Dalal SS.","Neuroimage. 2019 Apr 1;189:763-776. doi: 10.1016/j.neuroimage.2019.01.026. Epub 2019 Jan 11.","Leske S","Neuroimage","2019","2019/01/15","PMC6456018","EMS81353","10.1016/j.neuroimage.2019.01.026"
"30523864","Combined head phantom and neural mass model validation of effective connectivity measures","Peterson SM, Ferris DP.","J Neural Eng. 2019 Apr;16(2):026010. doi: 10.1088/1741-2552/aaf60e. Epub 2018 Dec 4.","Peterson SM","J Neural Eng","2019","2018/12/08","PMC6448772","NIHMS1020975","10.1088/1741-2552/aaf60e"
"30105544","Intracerebral EEG Artifact Identification Using Convolutional Neural Networks","Nejedly P, Cimbalnik J, Klimes P, Plesinger F, Halamek J, Kremen V, Viscor I, Brinkmann BH, Pail M, Brazdil M, Worrell G, Jurak P.","Neuroinformatics. 2019 Apr;17(2):225-234. doi: 10.1007/s12021-018-9397-6.","Nejedly P","Neuroinformatics","2019","2018/08/15","PMC6459786","","10.1007/s12021-018-9397-6"
"29516562","Automatic artefact detection in single-channel sleep EEG recordings","Malafeev A, Omlin X, Wierzbicka A, Wichniak A, Jernajczyk W, Riener R, Achermann P.","J Sleep Res. 2019 Apr;28(2):e12679. doi: 10.1111/jsr.12679. Epub 2018 Mar 8.","Malafeev A","J Sleep Res","2019","2018/03/09","","","10.1111/jsr.12679"
"30886202","Human electrocortical dynamics while stepping over obstacles","Nordin AD, Hairston WD, Ferris DP.","Sci Rep. 2019 Mar 18;9(1):4693. doi: 10.1038/s41598-019-41131-2.","Nordin AD","Sci Rep","2019","2019/03/20","PMC6423113","","10.1038/s41598-019-41131-2"
"30914936","Automatic Analysis of EEGs Using Big Data and Hybrid Deep Learning Architectures","Golmohammadi M, Harati Nejad Torbati AH, Lopez de Diego S, Obeid I, Picone J.","Front Hum Neurosci. 2019 Mar 12;13:76. doi: 10.3389/fnhum.2019.00076. eCollection 2019.","Golmohammadi M","Front Hum Neurosci","2019","2019/03/28","PMC6423064","","10.3389/fnhum.2019.00076"
"30896731","Perceptual reversals in binocular rivalry: Improved detection from OKN","Aleshin S, Ziman G, Kovács I, Braun J.","J Vis. 2019 Mar 1;19(3):5. doi: 10.1167/19.3.5.","Aleshin S","J Vis","2019","2019/03/22","","","10.1167/19.3.5"
"30604048","Cortical Signal Suppression (CSS) for Detection of Subcortical Activity Using MEG and EEG","Samuelsson JG, Khan S, Sundaram P, Peled N, Hämäläinen MS.","Brain Topogr. 2019 Mar;32(2):215-228. doi: 10.1007/s10548-018-00694-5. Epub 2019 Jan 3.","Samuelsson JG","Brain Topogr","2019","2019/01/04","PMC6374174","NIHMS1517832","10.1007/s10548-018-00694-5"
"30813520","Removal of Artifacts from EEG Signals: A Review","Jiang X, Bian GB, Tian Z.","Sensors (Basel). 2019 Feb 26;19(5):987. doi: 10.3390/s19050987.","Jiang X","Sensors (Basel)","2019","2019/03/01","PMC6427454","","10.3390/s19050987"
"30810597","Amplitude-integrated electroencephalography for neonatal seizure detection. An electrophysiological point of view","Gacio S.","Arq Neuropsiquiatr. 2019 Feb;77(2):122-130. doi: 10.1590/0004-282X20180150.","Gacio S","Arq Neuropsiquiatr","2019","2019/02/28","","","10.1590/0004-282X20180150"
"30653657","Safety and effectiveness of stereotactic laser ablation for epileptogenic cerebral cavernous malformations","Willie JT, Malcolm JG, Stern MA, Lowder LO, Neill SG, Cabaniss BT, Drane DL, Gross RE.","Epilepsia. 2019 Feb;60(2):220-232. doi: 10.1111/epi.14634. Epub 2019 Jan 17.","Willie JT","Epilepsia","2019","2019/01/18","PMC6365175","NIHMS1002051","10.1111/epi.14634"
"30605711","Preliminary experience with point-of-care EEG in post-cardiac arrest patients","Rittenberger JC, Weissman A, Baldwin M, Flickinger K, Repine MJ, Guyette FX, Doshi AA, Dezfulian C, Callaway CW, Elmer J; Pittsburgh Post Cardiac Arrest Service.","Resuscitation. 2019 Feb;135:98-102. doi: 10.1016/j.resuscitation.2018.12.022. Epub 2018 Dec 31.","Rittenberger JC","Resuscitation","2019","2019/01/04","PMC7155922","NIHMS1560636","10.1016/j.resuscitation.2018.12.022"
"30339731","Exploring the relative efficacy of motion artefact correction techniques for EEG data acquired during simultaneous fMRI","Daniel AJ, Smith JA, Spencer GS, Jorge J, Bowtell R, Mullinger KJ.","Hum Brain Mapp. 2019 Feb 1;40(2):578-596. doi: 10.1002/hbm.24396. Epub 2018 Oct 19.","Daniel AJ","Hum Brain Mapp","2019","2018/10/20","PMC6492138","","10.1002/hbm.24396"
"30709004","Quality Assessment of Single-Channel EEG for Wearable Devices","Grosselin F, Navarro-Sune X, Vozzi A, Pandremmenou K, De Vico Fallani F, Attal Y, Chavez M.","Sensors (Basel). 2019 Jan 31;19(3):601. doi: 10.3390/s19030601.","Grosselin F","Sensors (Basel)","2019","2019/02/03","PMC6387437","","10.3390/s19030601"
